{
  "schema_version": "subject-index-artifact-manifest-v1",
  "evaluation_id": "candidate-test",
  "created_at": "2026-08-21T12:00:00Z",
  "updated_at": "2026-08-21T12:00:00Z",
  "artifacts": [
    {
      "artifact_id": "ART-123456789ABC",
      "stage": "page_mapping",
      "artifact_type": "page-map",
      "path": "source/page-map.json",
      "sha256": "aaaaaaaaaaaaaaaaaaaaaaaaaaaaaaaaaaaaaaaaaaaaaaaaaaaaaaaaaaaaaaaa",
      "media_type": "application/json",
      "visibility": "private",
      "retention": "required",
      "frozen": true,
      "recorded_at": "2026-08-21T12:00:00Z"
    }
  ]
}
